{
  "project_id": "clientcare_billing_recovery",
  "name": "ClientCare Billing Recovery",
  "amendment_path": "docs/projects/AMENDMENT_18_CLIENTCARE_BILLING_RECOVERY.md",
  "lifecycle": "experimental",
  "status": "active",
  "priority": "critical",
  "owner": "adam",
  "phase": "payer-order-repair",
  "next_task": "Implement insurer-entry and payer-order repair workflows, then add provider-directed patient AR escalation controls on top of the current payer-playbook and ERA insight layers",
  "stability_class": "needs-review",
  "current_focus": "The Collections Control Center now has live backlog visibility, actionable ops overview, insurance verification preview, patient AR summary, assistant routing, controlled writeback for billing-status/provider-type/payment-status repair, payment-history import, underpayment queue, appeals queue, packet preview, queued follow-up actions, payer playbooks, ERA/remit insights, and forecast calibration against payer payment lag; next step is insurer-entry and payer-order repair plus patient AR escalation controls.",
  "owned_files": [
    "services/clientcare-billing-service.js",
    "services/clientcare-browser-service.js",
    "services/clientcare-sync-service.js",
    "services/clientcare-ops-service.js",
    "routes/clientcare-billing-routes.js",
    "public/clientcare-billing/overlay.html",
    "public/clientcare-billing/clientcare-billing.js",
    "db/migrations/20260326_clientcare_billing.sql",
    "db/migrations/20260326_clientcare_ops.sql",
    "docs/projects/AMENDMENT_18_CLIENTCARE_BILLING_RECOVERY.md",
    "docs/projects/AMENDMENT_18_CLIENTCARE_BILLING_RECOVERY.manifest.json"
  ],
  "protected_files": [
    "server.js",
    "routes/public-routes.js",
    "docs/SSOT_COMPANION.md"
  ],
  "required_files": [
    "services/clientcare-billing-service.js",
    "services/clientcare-browser-service.js",
    "services/clientcare-sync-service.js",
    "services/clientcare-ops-service.js",
    "routes/clientcare-billing-routes.js",
    "public/clientcare-billing/overlay.html",
    "public/clientcare-billing/clientcare-billing.js",
    "db/migrations/20260326_clientcare_billing.sql",
    "db/migrations/20260326_clientcare_ops.sql"
  ],
  "required_routes": [
    { "method": "GET", "path": "/api/v1/clientcare-billing/dashboard", "expected_status": 200, "description": "Billing dashboard summary" },
    { "method": "GET", "path": "/api/v1/clientcare-billing/browser/full-account-report", "expected_status": 200, "description": "Live ClientCare backlog summary" },
    { "method": "GET", "path": "/api/v1/clientcare-billing/ops/overview", "expected_status": 200, "description": "Ops overview for overlay" },
    { "method": "GET", "path": "/api/v1/clientcare-billing/payer-playbooks", "expected_status": 200, "description": "Payer-specific recovery playbooks" },
    { "method": "GET", "path": "/api/v1/clientcare-billing/era-insights", "expected_status": 200, "description": "ERA/remit insight summaries" },
    { "method": "GET", "path": "/api/v1/clientcare-billing/underpayments", "expected_status": 200, "description": "Underpayment queue" },
    { "method": "GET", "path": "/api/v1/clientcare-billing/appeals/queue", "expected_status": 200, "description": "Appeals queue" },
    { "method": "POST", "path": "/api/v1/clientcare-billing/appeals/:claimId/queue-action", "expected_status": 200, "description": "Queue appeal action" },
    { "method": "POST", "path": "/api/v1/clientcare-billing/underpayments/:claimId/queue-action", "expected_status": 200, "description": "Queue underpayment action" },
    { "method": "POST", "path": "/api/v1/clientcare-billing/history/import-csv", "expected_status": 200, "description": "Payment history import" },
    { "method": "POST", "path": "/api/v1/clientcare-billing/insurance/verification-preview", "expected_status": 200, "description": "Insurance intake preview" },
    { "method": "POST", "path": "/api/v1/clientcare-billing/assistant/message", "expected_status": 200, "description": "Operations Assistant message handling" }
  ],
  "required_tables": [
    { "name": "clientcare_claims", "required_columns": ["id", "patient_name", "payer_name", "date_of_service", "status", "bucket", "billed_amount", "paid_amount", "patient_balance"] },
    { "name": "clientcare_claim_actions", "required_columns": ["id", "claim_id", "action_type", "status", "priority"] },
    { "name": "clientcare_capability_requests", "required_columns": ["id", "request_text", "priority", "status", "requested_by", "created_at"] },
    { "name": "conversation_sessions", "required_columns": ["id", "conversation_type", "messages", "updated_at"] }
  ],
  "required_env": [
    "DATABASE_URL",
    "COMMAND_CENTER_KEY",
    "CLIENTCARE_BASE_URL",
    "CLIENTCARE_USERNAME",
    "CLIENTCARE_PASSWORD"
  ],
  "assertions": [
    { "type": "node_check", "check": "services/clientcare-billing-service.js", "label": "clientcare-billing-service syntax" },
    { "type": "node_check", "check": "services/clientcare-browser-service.js", "label": "clientcare-browser-service syntax" },
    { "type": "node_check", "check": "services/clientcare-sync-service.js", "label": "clientcare-sync-service syntax" },
    { "type": "node_check", "check": "services/clientcare-ops-service.js", "label": "clientcare-ops-service syntax" },
    { "type": "node_check", "check": "routes/clientcare-billing-routes.js", "label": "clientcare-billing-routes syntax" },
    { "type": "node_check", "check": "public/clientcare-billing/clientcare-billing.js", "label": "clientcare-billing overlay syntax" }
  ],
  "completion_checks": [
    "Collections Control Center auto-loads the live ClientCare backlog and KPI strip",
    "Accounts Needing Action is filterable and account detail loads on click",
    "Operations Assistant keeps running session history with archive behavior",
    "Insurance verification preview returns take/review/do-not-schedule guidance",
    "Patient AR summary shows aging buckets and top balances",
    "Workflow playbooks can be invoked from the overlay and return actionable steps",
    "Account Recovery Detail can preview/apply billing-status, provider-type, and payment-status repairs with save feedback",
    "Payment-history import accepts paid claims / ERA / remit CSV and feeds reimbursement learning",
    "Claims Ledger exposes an underpayment queue with short-pay amount and next action guidance",
    "Claims Ledger exposes an appeals queue with playbook-based denial guidance",
    "Underpayment and appeal queues can create tracked follow-up actions from the overlay",
    "Payer playbooks expose payer-specific denial patterns, average payment lag, and recommended next actions from imported history",
    "ERA/remit insights expose CARC/RARC and payment-method patterns from imported metadata",
    "Forecasting improves from imported paid claims / ERAs / remits instead of rescue buckets alone"
  ],
  "anti_drift_notes": "This product has two data layers: the live ClientCare browser backlog and the local claim ledger. Do not assume the claim ledger reflects the live backlog unless imports have run. Keep the overlay fast by loading backlog summary first and account details lazily. Do not enable autonomous collections behavior; all outreach and writeback remains provider-directed and compliance-gated.",
  "decision_debt": [
    { "description": "Forecast amount/date now uses payer payment lag when history exists, but remains low-confidence until enough paid claims, ERAs, and remits are imported", "resolved": false },
    { "description": "ClientCare read paths are live, and controlled writeback now covers billing status, provider type, and payment status; insurer entry and payer-order changes still need payer-specific/manual handling", "resolved": false },
    { "description": "Capability queue exists to capture missing assistant behaviors until they are implemented natively", "resolved": false },
    { "description": "Appeals queue and packet preview now exist, action queueing is live, and payer playbooks/ERA insights now derive from imported history, but deeper commercial-plan rules and insurer-entry/payer-order repair are still needed", "resolved": false }
  ],
  "last_verified_at": null,
  "verification_passed": null
}
